{
  "version": "0.5.0",
  "owner": "agent-cluster-contracts",
  "description": "Declares the SSOT chain: which DSL files emit which IR, which IR files generate which artifacts in which consumer repos, and which CI gates protect each link. tools/ssotdeps verify reads this file.",
  "ssot_artifacts": [
    {
      "id": "initial-agreement",
      "kind": "decision",
      "path": "decisions/2026/06/03/001-initial-agreement.decision.riido.json",
      "schema": "decisions/schema.riido.json",
      "mirrored_in": ["initial-agreement.md"],
      "owned_by": "agent-cluster-contracts"
    },
    {
      "id": "concept-map",
      "kind": "concept-map",
      "path": "concept-map/concept-map.riido.json",
      "schema": "concept-map/schema.riido.json",
      "owned_by": "agent-cluster-contracts"
    },
    {
      "id": "ssot-dep-map",
      "kind": "ssot-dependency-map",
      "path": "ssot-dependency-map.riido.json",
      "schema": null,
      "owned_by": "agent-cluster-contracts"
    },
    {
      "id": "research-ledger",
      "kind": "research",
      "path": "docs/research/source-ledger.riido.json",
      "schema": null,
      "owned_by": "agent-cluster-contracts"
    },
    {
      "id": "dsl-core",
      "kind": "dsl-source",
      "path": "dsl/core.lisp",
      "schema": null,
      "owned_by": "agent-cluster-contracts"
    },
    {
      "id": "dsl-work-item",
      "kind": "dsl-source",
      "path": "dsl/domain/work-item.lisp",
      "schema": null,
      "owned_by": "agent-cluster-contracts"
    },
    {
      "id": "dsl-emitter",
      "kind": "dsl-emitter",
      "path": "dsl/emit-ir.lisp",
      "schema": null,
      "owned_by": "agent-cluster-contracts"
    },
    {
      "id": "ir-work-item",
      "kind": "ir",
      "path": "ir/domain/work-item.ir.json",
      "schema": null,
      "owned_by": "agent-cluster-contracts"
    },
    {
      "id": "dsl-work-item-created",
      "kind": "dsl-source",
      "path": "dsl/domain/work-item-created.lisp",
      "schema": null,
      "owned_by": "agent-cluster-contracts"
    },
    {
      "id": "ir-work-item-created",
      "kind": "ir",
      "path": "ir/domain/work-item-created.ir.json",
      "schema": null,
      "owned_by": "agent-cluster-contracts"
    },
    {
      "id": "gen-go-client",
      "kind": "code-generator",
      "path": "tools/gen-go-client/main.go",
      "schema": null,
      "owned_by": "agent-cluster-contracts"
    },
    {
      "id": "gen-dart-client",
      "kind": "code-generator",
      "path": "tools/gen-dart-client/main.go",
      "schema": null,
      "owned_by": "agent-cluster-contracts"
    },
    {
      "id": "agent-roles",
      "kind": "agent-roles",
      "path": "agent-roles.riido.json",
      "schema": null,
      "mirrored_in": ["AGENT_CONTRACT.md"],
      "owned_by": "agent-cluster-contracts"
    },
    {
      "id": "tools-readme",
      "kind": "doc",
      "path": "tools/README.md",
      "schema": null,
      "owned_by": "agent-cluster-contracts"
    },
    {
      "id": "probe-tool",
      "kind": "verifier",
      "path": "tools/probe/main.go",
      "schema": null,
      "owned_by": "agent-cluster-contracts"
    },
    {
      "id": "environment-blockers-dir",
      "kind": "report-area",
      "path": "reports/environment-blockers/README.md",
      "schema": null,
      "owned_by": "agent-cluster-contracts"
    },
    {
      "id": "dsl-list-work-items",
      "kind": "dsl-source",
      "path": "dsl/domain/list-work-items.lisp",
      "schema": null,
      "owned_by": "agent-cluster-contracts"
    },
    {
      "id": "ir-list-work-items",
      "kind": "ir",
      "path": "ir/domain/list-work-items.ir.json",
      "schema": null,
      "owned_by": "agent-cluster-contracts"
    }
  ],
  "generation_links": [
    {
      "from": "dsl/domain/work-item.lisp",
      "emitter": "dsl/emit-ir.lisp",
      "to": "ir/domain/work-item.ir.json",
      "consumer_repo": "agent-cluster-contracts",
      "guard": "tools/irdrift (run in contracts.yml)"
    },
    {
      "from": "dsl/domain/work-item-created.lisp",
      "emitter": "dsl/emit-ir.lisp",
      "to": "ir/domain/work-item-created.ir.json",
      "consumer_repo": "agent-cluster-contracts",
      "guard": "tools/irdrift (run in contracts.yml)"
    },
    {
      "from": "ir/domain/work-item.ir.json",
      "emitter": "tools/gen-go-client",
      "to": "internal/contracts/work_item.go",
      "consumer_repo": "agent-cluster-backend",
      "guard": "contracts-drift.yml workflow in agent-cluster-backend"
    },
    {
      "from": "ir/domain/work-item-created.ir.json",
      "emitter": "tools/gen-go-client",
      "to": "internal/contracts/work_item_created.go",
      "consumer_repo": "agent-cluster-backend",
      "guard": "contracts-drift.yml workflow in agent-cluster-backend"
    },
    {
      "from": "ir/domain/work-item.ir.json",
      "emitter": "tools/gen-dart-client",
      "to": "lib/contracts_client/work_item.dart",
      "consumer_repo": "agent-cluster-frontend",
      "guard": "contracts-drift.yml workflow in agent-cluster-frontend"
    },
    {
      "from": "ir/domain/work-item-created.ir.json",
      "emitter": "tools/gen-dart-client",
      "to": "lib/contracts_client/work_item_created.dart",
      "consumer_repo": "agent-cluster-frontend",
      "guard": "contracts-drift.yml workflow in agent-cluster-frontend"
    },
    {
      "from": "dsl/domain/list-work-items.lisp",
      "emitter": "dsl/emit-ir.lisp",
      "to": "ir/domain/list-work-items.ir.json",
      "consumer_repo": "agent-cluster-contracts",
      "guard": "tools/irdrift (run in contracts.yml)"
    },
    {
      "from": "ir/domain/list-work-items.ir.json",
      "emitter": "tools/gen-go-client",
      "to": "internal/contracts/list_work_items.go",
      "consumer_repo": "agent-cluster-backend",
      "guard": "contracts-drift.yml workflow in agent-cluster-backend"
    },
    {
      "from": "ir/domain/list-work-items.ir.json",
      "emitter": "tools/gen-dart-client",
      "to": "lib/contracts_client/list_work_items.dart",
      "consumer_repo": "agent-cluster-frontend",
      "guard": "contracts-drift.yml workflow in agent-cluster-frontend"
    }
  ],
  "consumption_links": [
    {
      "ssot": "concept-map",
      "consumer_repo": "agent-cluster-contracts",
      "consumer_path": "tools/conceptmap/main.go",
      "via": "internal/conceptmap loader",
      "guard": "tools/conceptmap verify (run in contracts.yml)"
    },
    {
      "ssot": "initial-agreement",
      "consumer_repo": "agent-cluster-contracts",
      "consumer_path": "initial-agreement.md",
      "via": "human-readable mirror",
      "guard": "manual review (verifier diff check is a guard candidate)"
    },
    {
      "ssot": "ir-work-item",
      "consumer_repo": "agent-cluster-contracts",
      "consumer_path": "internal/irdrift/irdrift.go",
      "via": "irdrift reads ir/domain/*.ir.json and compares against regenerated copy",
      "guard": "tools/irdrift (run in contracts.yml)"
    },
    {
      "ssot": "agent-roles",
      "consumer_repo": "agent-cluster-contracts",
      "consumer_path": "internal/agentguard/agentguard.go",
      "via": "agentguard loads agent-roles.riido.json and applies the role's allowed/forbidden globs to the PR diff",
      "guard": "dumb-agent-safety.yml workflow"
    },
    {
      "ssot": "probe-tool",
      "consumer_repo": "agent-cluster-contracts",
      "consumer_path": "internal/probe/probe.go",
      "via": "probe tool composes decision/ssotdeps(local)/conceptmap/secretscan/irdrift for the dumb-agent baseline + walks fixtures/ for the fixture verifier",
      "guard": "contracts.yml workflow runs both `probe preflight` and `probe fixtures`"
    },
    {
      "ssot": "ir-work-item",
      "consumer_repo": "agent-cluster-backend",
      "consumer_path": "internal/contracts/work_item.go",
      "via": "gen-go-client emits this file from the IR; backend imports the package",
      "guard": "contracts-drift.yml workflow in agent-cluster-backend"
    },
    {
      "ssot": "ir-work-item-created",
      "consumer_repo": "agent-cluster-backend",
      "consumer_path": "internal/contracts/work_item_created.go",
      "via": "gen-go-client emits this file from the IR; backend emits this type on the /events SSE endpoint",
      "guard": "contracts-drift.yml workflow in agent-cluster-backend"
    },
    {
      "ssot": "ir-work-item",
      "consumer_repo": "agent-cluster-frontend",
      "consumer_path": "lib/contracts_client/work_item.dart",
      "via": "gen-dart-client emits this file from the IR; Flutter pages import it",
      "guard": "contracts-drift.yml workflow in agent-cluster-frontend"
    },
    {
      "ssot": "ir-work-item-created",
      "consumer_repo": "agent-cluster-frontend",
      "consumer_path": "lib/contracts_client/work_item_created.dart",
      "via": "gen-dart-client emits this file from the IR; reserved for the SSE consumer slice",
      "guard": "contracts-drift.yml workflow in agent-cluster-frontend"
    },
    {
      "ssot": "ir-list-work-items",
      "consumer_repo": "agent-cluster-backend",
      "consumer_path": "internal/contracts/list_work_items.go",
      "via": "gen-go-client emits ListWorkItemsQueryName const + ListWorkItemsResult alias; backend slice/server.go references the const instead of hand-typing the wire identifier",
      "guard": "contracts-drift.yml workflow in agent-cluster-backend"
    },
    {
      "ssot": "ir-list-work-items",
      "consumer_repo": "agent-cluster-frontend",
      "consumer_path": "lib/contracts_client/list_work_items.dart",
      "via": "gen-dart-client emits listWorkItemsQueryName Dart const; frontend code references this constant",
      "guard": "contracts-drift.yml workflow in agent-cluster-frontend"
    }
  ],
  "ci_gates": [
    {
      "repo": "agent-cluster-contracts",
      "workflow": ".github/workflows/contracts.yml",
      "verifies": [
        "initial-agreement",
        "concept-map",